{
  "case_id": "lincoln",
  "errors": [],
  "item_results": [
    {
      "errors": [],
      "index": 0,
      "item_id": "lincoln-multi-model-v1-packet:cmt:lincoln-ann-051",
      "raw_item": {
        "case_fields": {},
        "case_id": "lincoln",
        "cmt": {
          "cluster_id": "lincoln-04-birth-creation",
          "conceptual_metaphor": "THE FOUNDING OF THE NATION IS A BIRTH / NATIVITY EVENT; THE NATION IS A CHILD BROUGHT FORTH BY FATHERS",
          "entailments": [
            "The founding fathers are the generative parents of the nation, conferring on it both origin and identity.",
            "'Conceived' maps the ideational origin of the nation (in liberty) onto the biological moment of conception, implying the nation's animating principle was present from its very inception.",
            "'Brought forth' maps the historical founding act onto parturition, giving the nation a natal moment in time.",
            "'Dedicated' imports the ritual-religious register of consecration, so the newborn nation is simultaneously baptised or consecrated to a proposition.",
            "Because birth is natural and generative, the nation's existence carries biological legitimacy and inevitability.",
            "The birth frame suppresses the constructed, contested, and violent dimensions of founding."
          ],
          "source_domain_primary": "birth_generation",
          "source_domain_secondary": [
            "family_inheritance",
            "religion_providence"
          ],
          "target_domain": "founding"
        },
        "confidence": 0.88,
        "document_id": "lincoln-gettysburg-address",
        "item_id": "lincoln-multi-model-v1-packet:cmt:lincoln-ann-051",
        "lexical_units": [
          {
            "char_offset_end": 51,
            "char_offset_start": 44,
            "lexical_unit_id": "lincoln-gettysburg-address_s01_p01_s01_lu009",
            "source_text": "brought",
            "span_id": "lincoln-ann-051"
          },
          {
            "char_offset_end": 57,
            "char_offset_start": 52,
            "lexical_unit_id": "lincoln-gettysburg-address_s01_p01_s01_lu010",
            "source_text": "forth",
            "span_id": "lincoln-ann-051"
          },
          {
            "char_offset_end": 101,
            "char_offset_start": 92,
            "lexical_unit_id": "lincoln-gettysburg-address_s01_p01_s01_lu017",
            "source_text": "conceived",
            "span_id": "lincoln-ann-051"
          },
          {
            "char_offset_end": 127,
            "char_offset_start": 118,
            "lexical_unit_id": "lincoln-gettysburg-address_s01_p01_s01_lu021",
            "source_text": "dedicated",
            "span_id": "lincoln-ann-051"
          }
        ],
        "rival_reading": "Non-metaphorical / conventional reading: 'brought forth' and 'conceived' may be read as frozen or weakly conventionalized expressions equivalent to 'established' and 'founded upon the idea of', in which the birth imagery is entirely lexicalized and no live source-domain inference is projected. Under this reading the dominant mapping is simply NATION AS PROPOSITION (lincoln-03-experiment-proposition), with 'dedicated to the proposition' carrying the argumentative-logical weight and the birth vocabulary being stylistic amplification rather than a structuring metaphor.",
        "sentence_id": "lincoln-gettysburg-address_s01_p01_s01",
        "sentence_source_text": "Four score and seven years ago, our fathers brought forth upon this continent a new nation: conceived in liberty, and dedicated to the proposition that all men are created equal.",
        "source_language": "en",
        "source_risk_flags": [
          "gutenberg-ellipsis-style",
          "multiple-manuscript-versions-exist"
        ],
        "span_ids": [
          "lincoln-ann-051"
        ],
        "task_layer": "cmt",
        "uncertainty": {
          "note": "'Dedicated' introduces a secondary ritual-religion mapping (consecration) that partially competes with the birth frame; multiple manuscript versions create minor lexical uncertainty but do not alter the dominant metaphor cluster. 'Conceived in liberty' could be read as a straightforward prepositional phrase rather than a gestational metaphor, which is the main rival.",
          "status": "low"
        }
      },
      "status": "valid"
    },
    {
      "errors": [],
      "index": 1,
      "item_id": "lincoln-multi-model-v1-packet:cmt:lincoln-ann-054",
      "raw_item": {
        "case_fields": {},
        "case_id": "lincoln",
        "cmt": {
          "cluster_id": "lincoln-08-sacrificial-death-gift",
          "conceptual_metaphor": "THE WORLD / HISTORY IS A SENTIENT OBSERVER WITH MEMORY AND ATTENTION; COLLECTIVE HISTORICAL CONSCIOUSNESS IS A MIND THAT NOTES, REMEMBERS, AND FORGETS",
          "entailments": [
            "'The world' is personified as a single attentive agent capable of cognitive acts (noting, remembering, forgetting).",
            "Noting maps selective attention onto the world-mind; remembering maps long-term retention; forgetting maps failure of retention.",
            "The asymmetry (words forgotten, deeds remembered) implies that physical sacrifice is more cognitively salient to this mind than speech.",
            "History is framed as a continuous, unified consciousness rather than a dispersed, contested, multi-perspectival record.",
            "The frame rhetorically subordinates Lincoln's own speech act while simultaneously ensuring its memorability."
          ],
          "source_domain_primary": "person_agency",
          "source_domain_secondary": [
            "body"
          ],
          "target_domain": "history"
        },
        "confidence": 0.8,
        "document_id": "lincoln-gettysburg-address",
        "item_id": "lincoln-multi-model-v1-packet:cmt:lincoln-ann-054",
        "lexical_units": [
          {
            "char_offset_end": 9,
            "char_offset_start": 4,
            "lexical_unit_id": "lincoln-gettysburg-address_s01_p04_s03_lu002",
            "source_text": "world",
            "span_id": "lincoln-ann-054"
          },
          {
            "char_offset_end": 26,
            "char_offset_start": 22,
            "lexical_unit_id": "lincoln-gettysburg-address_s01_p04_s03_lu005",
            "source_text": "note",
            "span_id": "lincoln-ann-054"
          },
          {
            "char_offset_end": 45,
            "char_offset_start": 37,
            "lexical_unit_id": "lincoln-gettysburg-address_s01_p04_s03_lu008",
            "source_text": "remember",
            "span_id": "lincoln-ann-054"
          },
          {
            "char_offset_end": 88,
            "char_offset_start": 82,
            "lexical_unit_id": "lincoln-gettysburg-address_s01_p04_s03_lu017",
            "source_text": "forget",
            "span_id": "lincoln-ann-054"
          }
        ],
        "rival_reading": "Litotes / rhetorical understatement reading: 'The world will little note' is a deliberate understatement functioning as praeteritio (mentioning by denying), and 'note / remember / forget' are not primarily cognitive-personification metaphors but conventional speech-act and memory verbs applied collectively. Under this reading the dominant figure is irony or praeteritio, and the CMT interest lies not in personification but in the contrast between ephemeral speech and lasting deed, without projecting a unified world-mind source domain.",
        "sentence_id": "lincoln-gettysburg-address_s01_p04_s03",
        "sentence_source_text": "The world will little note, nor long remember, what we say here, but it can never forget what they did here.",
        "source_language": "en",
        "source_risk_flags": [
          "gutenberg-ellipsis-style",
          "multiple-manuscript-versions-exist"
        ],
        "span_ids": [
          "lincoln-ann-054"
        ],
        "task_layer": "cmt",
        "uncertainty": {
          "note": "The personification of 'the world' is conventional enough that some analysts may treat it as fully lexicalized rather than a live metaphor. The cluster assignment is debatable: the personification primarily serves to valorize soldier sacrifice (lincoln-08), but the world-as-mind frame could also support lincoln-05 (inheritance of memory). Multiple manuscript versions may affect exact wording but not the metaphor structure.",
          "status": "low"
        }
      },
      "status": "valid"
    },
    {
      "errors": [],
      "index": 2,
      "item_id": "lincoln-multi-model-v1-packet:cmt:lincoln-ann-003",
      "raw_item": {
        "case_fields": {},
        "case_id": "lincoln",
        "cmt": {
          "cluster_id": "lincoln-05-fathers-inheritance",
          "conceptual_metaphor": "THE POLITICAL ORDER (REPUBLIC OF LIBERTY AND EQUAL RIGHTS) IS A PHYSICAL EDIFICE CONSTRUCTED BY THE FOUNDERS AND BEQUEATHED INTACT TO SUBSEQUENT GENERATIONS",
          "entailments": [
            "'Uprear' maps the physical act of erecting a structure onto the founding of republican institutions, emphasizing deliberate human labor and vertical aspiration.",
            "'Edifice' maps a stable, load-bearing architectural structure onto the constitutional-political order, implying it has foundations, walls, and the possibility of structural decay or violation.",
            "'Transmit' maps the physical handover of a durable object across generations (inheritance frame) onto the civic obligation of preservation.",
            "'Unprofaned' imports a ritual-religious register: the edifice is also a sacred space whose sanctity can be violated by an invader's trespass.",
            "'Undecayed' maps organic or material deterioration onto institutional corruption or neglect over time.",
            "'Untorn' maps physical rending or demolition onto usurpation—illegitimate seizure of power that structurally damages the edifice.",